{
  "$schema": "https://json-schema.org/draft/2020-12/schema",
  "$id": "https://arsnova.eu/schemas/arsnova-click-export.schema.json",
  "title": "arsnova.click Quiz Export Snapshot",
  "description": "Documented snapshot schema for arsnova.click quiz exports. This mirrors the observed archive/import JSON shape, not a minimal API DTO.",
  "type": "object",
  "additionalProperties": true,
  "required": ["name", "readingConfirmationRequested", "sessionConfig", "questionList"],
  "properties": {
    "name": {
      "type": "string",
      "minLength": 1
    },
    "origin": {
      "type": "string"
    },
    "description": {
      "type": "string"
    },
    "state": {
      "type": "string",
      "enum": ["Inactive", "Active", "Running", "Finished"]
    },
    "currentQuestionIndex": {
      "type": "integer"
    },
    "currentStartTimestamp": {
      "type": "integer"
    },
    "sentQuestionIndex": {
      "type": "integer"
    },
    "readingConfirmationRequested": {
      "type": "boolean"
    },
    "questionCount": {
      "type": "integer",
      "minimum": 0
    },
    "sessionConfig": {
      "$ref": "#/$defs/sessionConfig"
    },
    "questionList": {
      "type": "array",
      "items": {
        "$ref": "#/$defs/question"
      }
    }
  },
  "$defs": {
    "defaultAnswerOption": {
      "type": "object",
      "additionalProperties": true,
      "required": ["TYPE", "answerText"],
      "properties": {
        "TYPE": {
          "const": "DefaultAnswerOption"
        },
        "answerText": {
          "type": "string"
        },
        "isCorrect": {
          "type": "boolean"
        }
      }
    },
    "freeTextAnswerOption": {
      "type": "object",
      "additionalProperties": true,
      "required": ["TYPE", "answerText"],
      "properties": {
        "TYPE": {
          "const": "FreeTextAnswerOption"
        },
        "answerText": {
          "type": "string"
        },
        "configCaseSensitive": {
          "type": "boolean"
        },
        "configTrimWhitespaces": {
          "type": "boolean"
        },
        "configUseKeywords": {
          "type": "boolean"
        },
        "configUsePunctuation": {
          "type": "boolean"
        }
      }
    },
    "memberGroup": {
      "type": "object",
      "additionalProperties": true,
      "required": ["name", "color"],
      "properties": {
        "name": {
          "type": "string"
        },
        "color": {
          "type": "string"
        }
      }
    },
    "musicEnabled": {
      "type": "object",
      "additionalProperties": true,
      "properties": {
        "lobby": {
          "type": "boolean"
        },
        "countdownRunning": {
          "type": "boolean"
        },
        "countdownEnd": {
          "type": "boolean"
        }
      }
    },
    "musicVolumeConfig": {
      "type": "object",
      "additionalProperties": true,
      "properties": {
        "global": {
          "type": "number"
        },
        "lobby": {
          "type": "number"
        },
        "countdownRunning": {
          "type": "number"
        },
        "countdownEnd": {
          "type": "number"
        },
        "useGlobalVolume": {
          "type": "boolean"
        }
      }
    },
    "musicTitleConfig": {
      "type": "object",
      "additionalProperties": true,
      "properties": {
        "lobby": {
          "type": "string"
        },
        "countdownRunning": {
          "type": "string"
        },
        "countdownEnd": {
          "type": "string"
        }
      }
    },
    "musicConfig": {
      "type": "object",
      "additionalProperties": true,
      "properties": {
        "enabled": {
          "$ref": "#/$defs/musicEnabled"
        },
        "volumeConfig": {
          "$ref": "#/$defs/musicVolumeConfig"
        },
        "titleConfig": {
          "$ref": "#/$defs/musicTitleConfig"
        }
      }
    },
    "nicksConfig": {
      "type": "object",
      "additionalProperties": true,
      "properties": {
        "memberGroups": {
          "type": "array",
          "items": {
            "$ref": "#/$defs/memberGroup"
          }
        },
        "maxMembersPerGroup": {
          "type": "integer"
        },
        "autoJoinToGroup": {
          "type": "boolean"
        },
        "selectedNicks": {
          "type": "array",
          "items": {
            "type": "string"
          }
        },
        "blockIllegalNicks": {
          "type": "boolean"
        }
      }
    },
    "sessionConfig": {
      "type": "object",
      "additionalProperties": true,
      "properties": {
        "confidenceSliderEnabled": {
          "type": "boolean"
        },
        "readingConfirmationEnabled": {
          "type": "boolean"
        },
        "showResponseProgress": {
          "type": "boolean"
        },
        "theme": {
          "type": "string"
        },
        "leaderboardAlgorithm": {
          "type": "string",
          "enum": ["PointBased", "TimeBased"]
        },
        "music": {
          "$ref": "#/$defs/musicConfig"
        },
        "nicks": {
          "$ref": "#/$defs/nicksConfig"
        }
      }
    },
    "questionBase": {
      "type": "object",
      "additionalProperties": true,
      "required": ["TYPE", "questionText", "answerOptionList"],
      "properties": {
        "TYPE": {
          "type": "string"
        },
        "displayAnswerText": {
          "type": "boolean"
        },
        "showOneAnswerPerRow": {
          "type": "boolean"
        },
        "multipleSelectionEnabled": {
          "type": "boolean"
        },
        "timer": {
          "type": "integer"
        },
        "questionText": {
          "type": "string"
        },
        "answerOptionList": {
          "type": "array"
        },
        "tags": {
          "type": "array",
          "items": {
            "type": "string"
          }
        },
        "requiredForToken": {
          "type": "boolean"
        },
        "difficulty": {
          "type": "integer",
          "minimum": 0
        }
      }
    },
    "singleChoiceQuestion": {
      "allOf": [
        {
          "$ref": "#/$defs/questionBase"
        },
        {
          "properties": {
            "TYPE": {
              "const": "SingleChoiceQuestion"
            },
            "answerOptionList": {
              "type": "array",
              "items": {
                "$ref": "#/$defs/defaultAnswerOption"
              }
            }
          }
        }
      ]
    },
    "yesNoSingleChoiceQuestion": {
      "allOf": [
        {
          "$ref": "#/$defs/questionBase"
        },
        {
          "properties": {
            "TYPE": {
              "const": "YesNoSingleChoiceQuestion"
            },
            "answerOptionList": {
              "type": "array",
              "items": {
                "$ref": "#/$defs/defaultAnswerOption"
              }
            }
          }
        }
      ]
    },
    "trueFalseSingleChoiceQuestion": {
      "allOf": [
        {
          "$ref": "#/$defs/questionBase"
        },
        {
          "properties": {
            "TYPE": {
              "const": "TrueFalseSingleChoiceQuestion"
            },
            "answerOptionList": {
              "type": "array",
              "items": {
                "$ref": "#/$defs/defaultAnswerOption"
              }
            }
          }
        }
      ]
    },
    "multipleChoiceQuestion": {
      "allOf": [
        {
          "$ref": "#/$defs/questionBase"
        },
        {
          "properties": {
            "TYPE": {
              "const": "MultipleChoiceQuestion"
            },
            "answerOptionList": {
              "type": "array",
              "items": {
                "$ref": "#/$defs/defaultAnswerOption"
              }
            }
          }
        }
      ]
    },
    "surveyQuestion": {
      "allOf": [
        {
          "$ref": "#/$defs/questionBase"
        },
        {
          "properties": {
            "TYPE": {
              "const": "SurveyQuestion"
            },
            "answerOptionList": {
              "type": "array",
              "items": {
                "$ref": "#/$defs/defaultAnswerOption"
              }
            }
          }
        }
      ]
    },
    "abcdSurveyQuestion": {
      "allOf": [
        {
          "$ref": "#/$defs/questionBase"
        },
        {
          "properties": {
            "TYPE": {
              "const": "ABCDSurveyQuestion"
            },
            "answerOptionList": {
              "type": "array",
              "items": {
                "$ref": "#/$defs/defaultAnswerOption"
              }
            }
          }
        }
      ]
    },
    "rangedQuestion": {
      "allOf": [
        {
          "$ref": "#/$defs/questionBase"
        },
        {
          "required": ["rangeMin", "rangeMax", "correctValue"],
          "properties": {
            "TYPE": {
              "const": "RangedQuestion"
            },
            "answerOptionList": {
              "type": "array",
              "maxItems": 0
            },
            "rangeMin": {
              "type": "number"
            },
            "rangeMax": {
              "type": "number"
            },
            "correctValue": {
              "type": "number"
            }
          }
        }
      ]
    },
    "freeTextQuestion": {
      "allOf": [
        {
          "$ref": "#/$defs/questionBase"
        },
        {
          "properties": {
            "TYPE": {
              "const": "FreeTextQuestion"
            },
            "answerOptionList": {
              "type": "array",
              "items": {
                "$ref": "#/$defs/freeTextAnswerOption"
              }
            }
          }
        }
      ]
    },
    "question": {
      "oneOf": [
        {
          "$ref": "#/$defs/singleChoiceQuestion"
        },
        {
          "$ref": "#/$defs/yesNoSingleChoiceQuestion"
        },
        {
          "$ref": "#/$defs/trueFalseSingleChoiceQuestion"
        },
        {
          "$ref": "#/$defs/multipleChoiceQuestion"
        },
        {
          "$ref": "#/$defs/surveyQuestion"
        },
        {
          "$ref": "#/$defs/abcdSurveyQuestion"
        },
        {
          "$ref": "#/$defs/rangedQuestion"
        },
        {
          "$ref": "#/$defs/freeTextQuestion"
        }
      ]
    }
  }
}
